First Name,Last Name,Email,Company,Job Title,Industry,Company Size,priority,priority_score,priority_reason,persona,persona_description,email_subject,email_body,simulated_reply,response_category,status
Elon,Musk,elon@spacex.com,SpaceX,CEO,Aerospace,10000+,High,10,"The lead is the CEO of SpaceX, a major Aerospace company with over 10,000 employees. As a top decision-maker in a high-relevance industry with significant budget potential for AI/automation solutions, this represents the highest priority.",The Aerospace Innovator,A visionary leader driven by the quest for exploration and technological advancement. This CEO prioritizes groundbreaking innovations and sustainable solutions that can transform the aerospace industry while ensuring the company's competitive edge and market leadership.,Unlocking New Efficiencies for SpaceX Operations,"Hi Elon,<br><br>As the CEO of SpaceX and a true <b>Aerospace Innovator</b>, I wanted to share how NexusAI can streamline your operations, driving ROI through automation of complex processes.<br><br>With our cutting-edge technology, you can focus on your visionary projects while we take care of the manual work.<br><br>Open to a 5-minute chat? <br>Best,<br>NexusAI Growth Team",Thanks for reaching out. I'm interested in hearing more about how NexusAI could enhance our operations at SpaceX. Let's schedule that chat.,Interested,Sent
Md Al,Amin,nsuer.alamin@gmail.com,GTR Ltd,Jr. AI Engineer,AI Solutions,50-100,Low,3,"The lead is a Jr. AI Engineer at a mid-sized AI Solutions company. While the industry is relevant, the junior role indicates limited decision-making authority and budget influence.",The Aspiring Innovator,"A motivated junior engineer passionate about advancing AI technology. They are eager to learn, grow their skill set, and contribute to innovative projects, often feeling pressure to prove their value in a fast-paced industry.",Quick question about AI automation at GTR Ltd,"Hi Md Al Amin,<br><br>As a <b>Jr. AI Engineer</b> at GTR Ltd, I thought you might be interested in how NexusAI can help you streamline your AI projects by automating repetitive tasks. This could free up your time for more innovative work and enhance your team's productivity.<br><br>Open to a 5-minute chat?<br><br>Best,<br>NexusAI Growth Team",Thanks for reaching out! I'm always looking for ways to enhance productivity and innovation. I would love to learn more—do you have some time this week to discuss further?,Interested,Sent
Michael,Scott,m.scott@dundermifflin.com,Dunder Mifflin,Regional Manager,Paper & Distribution,10-50,Low,3,"The lead is a Regional Manager at a small Paper & Distribution company with 10-50 employees. Low decision-making authority, limited budget potential, and industry unrelated to AI/automation.",The Efficiency Enforcer,"A mid-level manager who is focused on optimizing team performance and streamlining operations within the paper distribution industry. They are highly attuned to the needs of their team while needing to meet the expectations of upper management, often juggling multiple priorities and KPIs.",Streamlining Operations at Dunder Mifflin,"Hi Michael,<br><br>As the <b>Regional Manager</b> at Dunder Mifflin, I thought you'd find value in how NexusAI helps companies like yours streamline operations and eliminate manual tasks.<br><br>Would you be open to a 5-minute chat to see how we can save your team time and boost efficiency?<br><br>Best,<br>NexusAI Growth Team",Thanks for reaching out. I'm always looking for ways to improve efficiency—let's schedule that chat. How does Thursday look for you?,Interested,Sent
Sarah,Connor,s.connor@cyberdyne.io,Cyberdyne Systems,Security Operations Lead,Robotics,500-1000,Medium,6,"The lead is a Security Operations Lead at a Robotics company with 500-1000 employees. Mid-level management role with industry relevance to AI/automation, but not a top decision-maker.",The Cyber Guardian,A proactive leader in cybersecurity who prioritizes risk management and the integrity of technological systems. They are driven by the need to protect their organization's assets while fostering a culture of innovation within the robotics sector.,Streamlining Security Operations at Cyberdyne Systems,"Hi Sarah,<br><br>As a <b>Security Operations Lead</b>, I wanted to share how NexusAI can help Cyberdyne Systems enhance its efficiency by automating repetitive security tasks. Imagine freeing up your team to focus on proactive measures instead of manual data entry.<br><br>Open to a 5-minute chat to explore how we can support your initiatives?<br><br>Best,<br>NexusAI Growth Team",Thanks for reaching out. I'm interested in understanding how NexusAI can integrate with our existing systems. Can we schedule a meeting for next week?,Interested,Sent
Satya,Nadella,satya@microsoft.com,Microsoft,CEO,Software,10000+,High,10,"The lead is the CEO of Microsoft, a major Software company in the Tech industry. As a top decision-maker with a company size of 10,000+ employees, this lead has significant authority and budget potential for AI/automation solutions.",The Strategic Innovator,"As the CEO of Microsoft, Satya Nadella is a visionary leader focused on leveraging cutting-edge technology and digital transformation to maintain market leadership. He is driven by a passion for innovation and is highly concerned with long-term sustainability and competitive advantage.",Exploring AI-driven innovations for Microsoft,"Hi Satya,<br><br>As the CEO of Microsoft, a leader in technological advancements, you might find it intriguing how NexusAI is enabling strategic innovators to leverage automation for unprecedented ROI and market leadership.<br><br>Open to a 5-minute chat to explore potential synergies?<br><br>Best,<br>NexusAI Growth Team",Thank you for reaching out. I’m always interested in exploring how automation can enhance our strategic initiatives. Let's schedule a brief chat to discuss further.,Interested,Sent
Arman,Hossain,arman@tech-bangla.com,TechBangla,CTO,E-commerce,1-10,Medium,6,"The lead is a CTO in the E-commerce industry. While the job title indicates decision-making authority, the company size is very small (1-10 employees) and the industry is not directly aligned with AI/automation. Potential for growth exists but with moderate budget capacity.",The E-commerce Trailblazer,A strategic technology leader focused on integrating innovative solutions to enhance user experience and operational efficiency. They are driven by the need to leverage technology to gain competitive advantages in the rapidly changing e-commerce landscape.,Quick question about TechBangla's automation strategy,"Hi Arman,<br><br>As the <b>CTO at TechBangla</b>, I thought you’d be interested in how NexusAI can help e-commerce leaders like yourself save time by automating repetitive tasks. Our platform streamlines operations, allowing your team to focus on what truly drives revenue.<br><br>Open to a 5-minute chat?<br><br>Best,<br>NexusAI Growth Team",Thanks for reaching out! I'm always looking for ways to optimize our operations. Let's schedule a quick chat this week to discuss how NexusAI could fit into our strategy.,Interested,Sent
Dwight,Schrute,d.schrute@dundermifflin.com,Dunder Mifflin,Assistant to the Regional Manager,Paper,10-50,Low,3,The lead holds a junior administrative role at a small company in an unrelated industry. Low decision-making authority and limited budget potential for AI automation.,The Diligent Enforcer,A detail-oriented professional who prioritizes operational efficiency and team productivity. They often find themselves juggling multiple responsibilities and are deeply invested in supporting their team while ensuring that processes run smoothly. They seek solutions that help alleviate workflow bottlenecks and improve team dynamics.,Streamline Operations at Dunder Mifflin,"Hi Dwight,<br><br>As the <b>Assistant to the Regional Manager</b>, I know you value efficiency at Dunder Mifflin. NexusAI can help you save time by automating repetitive tasks, allowing you to focus more on enforcing productivity and less on manual work.<br><br>Open to a 5-minute chat to explore how we can lighten your load?<br><br>Best,<br>NexusAI Growth Team","I appreciate your email. Efficiency is key, but I'm currently focused on our existing priorities. Please follow up next month.",Neutral,Sent
Peter,Parker,p.parker@dailybugle.com,Daily Bugle,Photojournalist,Media,50-200,Low,2,The lead is a Photojournalist at a Media company with 50-200 employees. Junior role with limited decision-making authority and low relevance to AI/automation industries.,The Storytelling Innovator,"A creative professional who thrives on capturing compelling narratives through visual media. Peter is driven by the need to stay relevant in a rapidly evolving media landscape, constantly seeking innovative techniques to enhance storytelling and engage audiences.",Quick question about enhancing storytelling at Daily Bugle,"Hi Peter,<br><br>As a <b>Photojournalist</b> at the <b>Daily Bugle</b>, I know how crucial it is to capture and share compelling stories. NexusAI can help you streamline your photo selection process, allowing you to focus more on storytelling and less on manual tasks.<br><br>Open to a 5-minute chat?<br>Best,<br>NexusAI Growth Team","Hi NexusAI Team,

Thanks for reaching out! I’m always on the lookout for tools that enhance my storytelling. I’d love to chat and hear more about how NexusAI can streamline my workflow. When are you available this week?

Best,
Peter",Interested,Sent
Tony,Stark,tony@starkindustries.com,Stark Industries,Founder,Energy & Defense,5000+,High,9,"The lead is the Founder of a large Energy & Defense company with 5000+ employees. High decision-making authority and substantial budget potential for AI automation, despite the industry being adjacent to core focus areas.",The Strategic Innovator,"A visionary leader in the energy and defense sector who prioritizes sustainable growth and technological advancement. Driven by the desire to outpace competition and leverage cutting-edge innovations, this persona is consistently seeking solutions that align with both current market demands and future industry trends.",Unlocking New Innovations at Stark Industries,"Hi Tony,<br><br>As the <b>Founder</b> of Stark Industries, your commitment to innovation truly sets you apart. I believe NexusAI can empower your vision by automating processes that currently consume valuable resources, allowing your team to focus on groundbreaking projects.<br><br>Open to a 5-minute chat to explore how we can elevate Stark Industries' market leadership?<br><br>Best,<br>NexusAI Growth Team",Appreciate the outreach. I'm always looking for ways to innovate—let's schedule that chat for next week to see how NexusAI can align with our goals.,Interested,Sent
Lutfur,Rahman,lutfur@dhaka-solutions.net,Dhaka Solutions,Founder,IT Services,1-10,Medium,6,"The lead is a Founder of a small IT Services company. While they have decision-making authority, the company's small size (1-10 employees) limits budget potential.",The Agile Innovator,"A dynamic entrepreneur who thrives on adapting to market changes and leveraging technology for growth. They prioritize innovation and efficiency, often wearing multiple hats to drive their small business forward.",Quick question regarding Dhaka Solutions' innovation efforts,"Hi Lutfur,<br><br>As the Founder of Dhaka Solutions, I believe you are constantly looking for ways to innovate and streamline your operations. NexusAI can help automate time-consuming processes, allowing your team to focus on what truly matters—driving growth and innovation.<br><br>Open to a 5-minute chat?<br>Best,<br>NexusAI Growth Team",Thanks for reaching out! I’m always interested in learning about innovative solutions. Would love to set up a quick chat this week to see how NexusAI can fit into our strategy.,Interested,Sent
Bruce,Wayne,bruce@waynetech.com,Wayne Enterprises,Chairman,Conglomerate,10000+,High,9,"The lead is a Chairman of a large conglomerate with over 10,000 employees. High decision-making authority and substantial budget potential despite non-specific industry alignment with AI/tech sectors.",The Strategic Overlord,A high-level executive with a keen focus on long-term strategic planning and market dominance. This persona thrives on innovation and is constantly seeking ways to leverage technology to enhance operational efficiency and drive growth across diverse business units.,Unlocking Market Leadership at Wayne Enterprises,"Hi Bruce,<br><br>As the Chairman of Wayne Enterprises, I know you’re always seeking ways to elevate your market leadership. NexusAI empowers strategic visionaries like you by automating complex data analyses, helping you make faster, informed decisions that drive substantial ROI.<br><br>Open to a 5-minute chat? I’d love to explore how we can support your strategic initiatives.<br><br>Best,<br>NexusAI Growth Team","Thank you for reaching out. I'm intrigued by the potential of NexusAI, but I prefer to review detailed case studies first. Can you send over some relevant materials?",Interested,Sent
Pam,Beesly,p.beesly@dundermifflin.com,Dunder Mifflin,Office Administrator,Paper,10-50,Low,3,"The lead is an Office Administrator at a small Paper company (10-50 employees). Non-technical role, non-relevant industry, and limited decision-making authority or budget potential for AI automation.",The Detail-Oriented Facilitator,"A meticulous office administrator who ensures smooth operations within a small team. Pam is focused on optimizing processes to enhance efficiency and support her colleagues, often juggling multiple responsibilities and looking for ways to streamline day-to-day tasks.",Streamlining Dunder Mifflin's Office Tasks,"Hi Pam,<br><br>As the <b>Office Administrator</b> at Dunder Mifflin, I thought you might be interested in how NexusAI can help simplify your daily tasks and minimize those time-consuming manual processes.<br><br>Open to a 5-minute chat?<br><br>Best,<br>NexusAI Growth Team",Thanks for your message. I'm always looking for ways to improve efficiency—could you provide more details on how NexusAI works before we chat?,Interested,Sent
Sam,Altman,sam@openai.com,OpenAI,CEO,Artificial Intelligence,500-1000,High,10,"The lead is the CEO of a major Artificial Intelligence company with 500-1000 employees. As a top decision-maker in a directly relevant industry with significant company size, this lead represents exceptional potential for high-value AI automation partnerships.",The Strategic Innovator,"A visionary leader at the helm of technological advancement, focused on deploying AI solutions that drive efficiency and create new market opportunities. They prioritize long-term growth and sustainability while keenly aware of the competitive landscape.",Unlocking new AI efficiencies at OpenAI,"Hi Sam,<br><br>As the <b>CEO at OpenAI</b>, your vision for advancing AI technology is truly inspiring. I believe NexusAI can elevate your strategy by automating manual processes, enabling your team to focus on innovation and staying ahead in the competitive AI landscape.<br><br>Open to a 5-minute chat to explore how we can support your goals?<br><br>Best,<br>NexusAI Growth Team",Thanks for reaching out. I'm always interested in ideas that can enhance our innovation strategy. Let's schedule a brief chat to discuss this further.,Interested,Sent
Anika,Tabassum,anika@brac-it.org,BRAC IT,Project Manager,Non-profit IT,200-500,Medium,6,"The lead is a Project Manager at a mid-sized Non-profit IT organization. While the company size suggests moderate budget potential, the role is mid-level and the industry is not directly aligned with high-priority sectors like Tech or AI.",The Mission-Driven Planner,"Anika is a dedicated project manager in the non-profit IT sector, focused on delivering impactful solutions that align with the organization's mission. She is driven by the need to optimize resources and ensure project success while navigating the complexities of non-profit funding and stakeholder expectations.",How NexusAI can streamline your projects at BRAC IT,"Hi Anika,<br><br>As a <b>Project Manager</b> at BRAC IT, I wanted to share how NexusAI can help you streamline your project workflows by automating repetitive tasks. Imagine reallocating that time to focus on driving your mission forward!<br><br>Open to a 5-minute chat to explore this? <br><br>Best,<br>NexusAI Growth Team","Thank you for reaching out. I appreciate your message, but I'm currently focused on our existing projects and won't be able to explore new solutions at this time.",Not Interested,Sent
John,Wick,j.wick@continental.com,The Continental,Safety Consultant,Hospitality,100-200,Medium,6,"The lead is a Safety Consultant at a mid-sized Hospitality company. Mid-level role with moderate budget potential, but industry is not aligned with AI/tech focus.",The Safety Sentinel,"A proactive and detail-oriented professional dedicated to ensuring safety standards in the hospitality industry. John is focused on mitigating risks, enhancing guest experiences, and complying with industry regulations, all while maintaining operational efficiency.",Enhancing safety efficiency at The Continental,"Hi John,<br><br>As a <b>Safety Consultant</b> at The Continental, I'm sure you understand the importance of streamlining safety protocols. NexusAI can help automate your reporting processes, allowing you to focus on proactive safety measures rather than manual data entry.<br><br>Open to a 5-minute chat?<br><br>Best,<br>NexusAI Growth Team","I appreciate you reaching out. Ensuring efficient safety processes is crucial for us, so I’d be interested in learning more. Could we schedule a chat this week?",Interested,Sent
Sherlock,Holmes,s.holmes@221b.com,Consulting Detective,Founder,Legal Services,1-5,Low,2,"The lead is a Founder of a small Legal Services company with 1-5 employees. While the role is a decision-maker, the company size is minimal, and the industry is unrelated to AI/automation, resulting in low potential for a high-value partnership.",The Insightful Innovator,"A strategic thinker dedicated to leveraging unique insights to solve complex problems. As the founder of a niche consulting firm within the legal services industry, they prioritize establishing credibility and building a strong client base while navigating the challenges of a competitive landscape.",Curious about automating insights at Consulting Detective,"Hi Sherlock,<br><br>As the <b>Founder</b> at Consulting Detective, I thought you might be interested in how NexusAI can streamline automating your insights and remove manual analysis tasks. Our solution is designed to free up your time, allowing you to focus on solving complex cases.<br><br>Open to a 5-minute chat?<br>Best,<br>NexusAI Growth Team",Thank you for reaching out. I'm intrigued by the potential of NexusAI to enhance my analysis process—let's schedule that 5-minute chat to explore this further.,Interested,Sent
Tanvir,Ahmed,tanvir@pathao.com,Pathao,Data Scientist,Logistics,500-1000,Medium,6,"The lead is a Data Scientist at a mid-sized Logistics company. While the industry is relevant to AI/automation, the role is technical and not a top decision-maker, indicating moderate budget influence.",The Data-Driven Innovator,"A meticulous Data Scientist in the logistics industry, Tanvir thrives on transforming complex data into actionable insights. He is passionate about using advanced analytics to optimize supply chain efficiency and enhance customer experience. His focus is on leveraging cutting-edge technology to gain competitive advantage and streamline operations.",Quick question regarding Pathao's data processes,"Hi Tanvir,<br><br>As a <b>Data Scientist</b> at Pathao, I thought you might find value in how NexusAI is helping data-driven innovators like yourself automate their data analysis processes. By minimizing manual tasks, our solution allows you to focus on actionable insights instead of data entry.<br><br>Open to a 5-minute chat? <br><br>Best,<br>NexusAI Growth Team",Thanks for reaching out. I'm interested in learning more about how NexusAI can enhance our data analysis processes—let's schedule a chat this week.,Interested,Sent
Mark,Zuckerberg,mark@meta.com,Meta,CEO,Social Media,10000+,High,9,"The lead is the CEO of Meta, a large technology company with over 10,000 employees. As a top decision-maker in a major tech firm, they have significant authority and budget potential for AI/automation solutions.",The Social Media Strategist,"A visionary leader in the fast-paced social media landscape, Mark is focused on driving innovation and growth while navigating complex user engagement challenges. He is deeply committed to enhancing platform capabilities and ensuring user satisfaction, all while remaining competitive in a rapidly evolving market.",Enhancing Meta's Social Media Strategy with Automation,"Hi Mark,<br><br>As the CEO of Meta, your vision for social media innovation is unparalleled. I wanted to share how NexusAI can further amplify your strategy by automating content management and audience engagement, enabling you to focus on market leadership and ROI.<br><br>Open to a 5-minute chat?<br>Best,<br>NexusAI Growth Team",Thanks for reaching out. I appreciate the offer but I'm currently focused on other priorities. Best of luck with NexusAI!,Not Interested,Sent
Jeb,Bush,jeb@bush-consulting.com,Bush Consulting,Independent Consultant,Politics,1,Low,2,"The lead is an Independent Consultant in the Politics industry with a company size of 1. Low decision-making authority, unrelated industry, and minimal budget potential.",The Strategic Advisor,"A seasoned consultant in the political arena who prides himself on providing invaluable insights and strategies. Jeb is focused on building strong relationships and delivering impactful results for his clients, while navigating the complexities of political landscapes.",Quick question regarding your consulting efficiency,"Hi Jeb,<br><br>As an <b>Independent Consultant</b>, I thought you'd be interested in how NexusAI can streamline your processes at Bush Consulting. Our automation tools can save you time by reducing manual tasks, allowing you to focus more on providing strategic advice to your clients.<br><br>Open to a 5-minute chat?<br>Best,<br>NexusAI Growth Team",Thanks for reaching out. I'm interested in learning more about how NexusAI can enhance our processes; let's set up a chat next week to discuss this further.,Interested,Sent
Harvey,Specter,h.specter@pearson-hardman.com,Pearson Hardman,Senior Partner,Law,200-500,Medium,7,"The lead is a Senior Partner at a mid-sized law firm. While they hold significant decision-making authority, the industry is not aligned with AI/tech, which reduces the priority.",The Strategic Legal Architect,"A seasoned leader in the legal industry who prioritizes strategic growth and client satisfaction. They focus on optimizing legal processes, ensuring compliance, and staying ahead of regulatory changes while managing a diverse team of associates.",Unlock Efficiency at Pearson Hardman,"Hi Harvey,<br><br>As a Senior Partner at Pearson Hardman, I know how crucial it is for you to streamline processes while maintaining impeccable service. NexusAI can help legal firms like yours save hours on manual data entry, allowing your team to focus on high-stakes strategy instead.<br><br>Open to a 5-minute chat to explore how we can maximize your firm's productivity?<br><br>Best,<br>NexusAI Growth Team",Thanks for reaching out. I'm interested in how NexusAI can help streamline our processes. Can you send over some more information or set up a quick call next week?,Interested,Sent
